{
  "$schema": "https://json-schema.org/draft/2020-12/schema",
  "$id": "https://dex/contracts/portable-vault.v2.schema.json",
  "title": "Dex Portable Vault Ownership Contract",
  "type": "object",
  "additionalProperties": false,
  "required": [
    "contract_version",
    "source",
    "vault_schema_supported",
    "ownership_classes",
    "mutation_policy",
    "customization_migration",
    "release_anchor",
    "establish_baseline",
    "hard_deny",
    "vault_regions",
    "rules",
    "capabilities"
  ],
  "properties": {
    "contract_version": {
      "const": 2
    },
    "source": {
      "const": "core/portable_contract.py"
    },
    "vault_schema_supported": {
      "type": "string",
      "minLength": 1
    },
    "mutation_policy": {
      "type": "object",
      "additionalProperties": false,
      "required": [
        "brain",
        "vault",
        "seed",
        "generated",
        "runtime"
      ],
      "properties": {
        "brain": {
          "enum": [
            "replace",
            "write-if-absent",
            "regenerate",
            "never"
          ]
        },
        "vault": {
          "enum": [
            "replace",
            "write-if-absent",
            "regenerate",
            "never"
          ]
        },
        "seed": {
          "enum": [
            "replace",
            "write-if-absent",
            "regenerate",
            "never"
          ]
        },
        "generated": {
          "enum": [
            "replace",
            "write-if-absent",
            "regenerate",
            "never"
          ]
        },
        "runtime": {
          "enum": [
            "replace",
            "write-if-absent",
            "regenerate",
            "never"
          ]
        }
      }
    },
    "customization_migration": {
      "type": "object",
      "additionalProperties": false,
      "required": [
        "version",
        "action",
        "seam_prefixes",
        "seam_paths"
      ],
      "properties": {
        "version": {
          "const": 0
        },
        "action": {
          "const": "write-with-user-approval"
        },
        "seam_prefixes": {
          "type": "array",
          "items": {
            "type": "string",
            "minLength": 1
          },
          "uniqueItems": true
        },
        "seam_paths": {
          "type": "array",
          "items": {
            "type": "string",
            "minLength": 1
          },
          "uniqueItems": true
        }
      }
    },
    "release_anchor": {
      "type": "object",
      "additionalProperties": false,
      "required": [
        "version",
        "action",
        "seam_paths"
      ],
      "properties": {
        "version": {
          "const": 0
        },
        "action": {
          "const": "write-release-anchor"
        },
        "seam_paths": {
          "type": "array",
          "items": {
            "type": "string",
            "minLength": 1
          },
          "minItems": 1,
          "uniqueItems": true
        }
      }
    },
    "establish_baseline": {
      "type": "object",
      "additionalProperties": false,
      "required": [
        "version",
        "action",
        "seam_paths"
      ],
      "properties": {
        "version": {
          "const": 0
        },
        "action": {
          "const": "write-establish-baseline"
        },
        "seam_paths": {
          "type": "array",
          "items": {
            "type": "string",
            "minLength": 1
          },
          "minItems": 1,
          "uniqueItems": true
        }
      }
    },
    "ownership_classes": {
      "type": "array",
      "items": {
        "enum": [
          "brain",
          "vault",
          "seed",
          "generated",
          "runtime"
        ]
      },
      "minItems": 5,
      "maxItems": 5,
      "uniqueItems": true
    },
    "hard_deny": {
      "type": "array",
      "items": {
        "type": "string",
        "minLength": 1
      },
      "minItems": 1,
      "uniqueItems": true
    },
    "vault_regions": {
      "type": "array",
      "items": {
        "type": "string",
        "minLength": 1
      },
      "minItems": 1,
      "uniqueItems": true
    },
    "rules": {
      "type": "array",
      "minItems": 1,
      "items": {
        "type": "object",
        "additionalProperties": false,
        "required": [
          "id",
          "path",
          "kind",
          "ownership"
        ],
        "properties": {
          "id": {
            "type": "string",
            "pattern": "^[a-z0-9-]+$"
          },
          "path": {
            "type": "string",
            "minLength": 1
          },
          "kind": {
            "enum": [
              "file",
              "dir"
            ]
          },
          "ownership": {
            "enum": [
              "brain",
              "vault",
              "seed",
              "generated",
              "runtime"
            ]
          },
          "note": {
            "type": "string",
            "minLength": 1
          }
        }
      }
    },
    "capabilities": {
      "type": "object",
      "additionalProperties": {
        "type": "object",
        "additionalProperties": false,
        "required": [
          "default_enabled",
          "folders",
          "skills",
          "skill_sources"
        ],
        "properties": {
          "default_enabled": {
            "type": "boolean"
          },
          "folders": {
            "type": "array",
            "items": {
              "type": "string",
              "minLength": 1
            },
            "minItems": 1
          },
          "skills": {
            "type": "array",
            "items": {
              "type": "string"
            }
          },
          "mcp": {
            "type": "array",
            "items": {
              "type": "string"
            }
          },
          "features": {
            "type": "array",
            "items": {
              "type": "string"
            }
          },
          "config": {
            "type": "string",
            "minLength": 1
          },
          "skill_sources": {
            "type": "array",
            "items": {
              "type": "object",
              "additionalProperties": false,
              "required": [
                "room",
                "skill",
                "source_path",
                "target_path",
                "sha256",
                "byte_size",
                "previous_payloads"
              ],
              "properties": {
                "room": {
                  "type": "string",
                  "minLength": 1
                },
                "skill": {
                  "type": "string",
                  "minLength": 1
                },
                "source_path": {
                  "type": "string",
                  "minLength": 1
                },
                "target_path": {
                  "type": "string",
                  "minLength": 1
                },
                "sha256": {
                  "type": "string",
                  "pattern": "^[0-9a-f]{64}$"
                },
                "byte_size": {
                  "type": "integer",
                  "minimum": 0
                },
                "previous_payloads": {
                  "type": "array",
                  "uniqueItems": true,
                  "items": {
                    "type": "object",
                    "additionalProperties": false,
                    "required": [
                      "release",
                      "sha256",
                      "byte_size"
                    ],
                    "properties": {
                      "release": {
                        "type": "string",
                        "pattern": "^v[0-9]+\\.[0-9]+\\.[0-9]+$"
                      },
                      "sha256": {
                        "type": "string",
                        "pattern": "^[0-9a-f]{64}$"
                      },
                      "byte_size": {
                        "type": "integer",
                        "minimum": 0
                      }
                    }
                  }
                }
              }
            }
          }
        }
      }
    }
  }
}
