{
  "contract_version": 2,
  "source": "core/portable_contract.py",
  "vault_schema_supported": ">=1 <2",
  "ownership_classes": [
    "brain",
    "vault",
    "seed",
    "generated",
    "runtime"
  ],
  "mutation_policy": {
    "brain": "replace",
    "generated": "regenerate",
    "runtime": "never",
    "seed": "write-if-absent",
    "vault": "never"
  },
  "customization_migration": {
    "version": 0,
    "action": "write-with-user-approval",
    "seam_prefixes": [
      "System/.dex/customization-migrations/"
    ],
    "seam_paths": [
      "CLAUDE-custom.md"
    ]
  },
  "release_anchor": {
    "version": 0,
    "action": "write-release-anchor",
    "seam_paths": [
      "System/.dex/release-anchor.json",
      "System/.dex/release-anchor.receipt.json"
    ]
  },
  "establish_baseline": {
    "version": 0,
    "action": "write-establish-baseline",
    "seam_paths": [
      "System/.installed-files.manifest",
      "System/.release-catalog.json",
      "core/lifecycle/catalog/release-hashes.json",
      "System/.dex/established-baseline.receipt.json"
    ]
  },
  "hard_deny": [
    ".env",
    ".env.*",
    ".git",
    ".git/*",
    "System/credentials",
    "System/credentials/*",
    "*token.json",
    "*.key",
    "*.pem"
  ],
  "vault_regions": [
    "00-Inbox",
    "01-Quarter_Goals",
    "02-Week_Priorities",
    "03-Tasks",
    "04-Projects",
    "05-Areas",
    "06-Resources",
    "07-Archives"
  ],
  "rules": [
    {
      "id": "brain-agents",
      "path": ".agents",
      "kind": "dir",
      "ownership": "brain"
    },
    {
      "id": "vault-agents-skills-custom",
      "path": ".agents/skills/*-custom",
      "kind": "dir",
      "ownership": "vault",
      "note": "user-authored portable skill convention; never replace a generated skill"
    },
    {
      "id": "brain-ci",
      "path": ".ci",
      "kind": "dir",
      "ownership": "brain",
      "note": "CI shard-balance data; dev-only, stripped from releases via .distignore"
    },
    {
      "id": "brain-claude",
      "path": ".claude",
      "kind": "dir",
      "ownership": "brain",
      "note": "shipped skills/hooks/flows; user skills belong in .claude/skills-custom/ (vault)"
    },
    {
      "id": "vault-skills-custom",
      "path": ".claude/skills-custom",
      "kind": "dir",
      "ownership": "vault"
    },
    {
      "id": "vault-claude-skills-custom",
      "path": ".claude/skills/*-custom",
      "kind": "dir",
      "ownership": "vault",
      "note": "user-authored skill convention; never replace a generated or shipped skill"
    },
    {
      "id": "brain-cursor",
      "path": ".cursor",
      "kind": "dir",
      "ownership": "brain"
    },
    {
      "id": "brain-distignore",
      "path": ".distignore",
      "kind": "file",
      "ownership": "brain"
    },
    {
      "id": "vault-env",
      "path": ".env",
      "kind": "file",
      "ownership": "vault",
      "note": "raw secret authority (SR1 #150 model)"
    },
    {
      "id": "brain-gitattributes",
      "path": ".gitattributes",
      "kind": "file",
      "ownership": "brain"
    },
    {
      "id": "brain-github",
      "path": ".github",
      "kind": "dir",
      "ownership": "brain"
    },
    {
      "id": "brain-gitignore",
      "path": ".gitignore",
      "kind": "file",
      "ownership": "brain"
    },
    {
      "id": "runtime-logs",
      "path": ".logs",
      "kind": "dir",
      "ownership": "runtime"
    },
    {
      "id": "vault-mcp-json",
      "path": ".mcp.json",
      "kind": "file",
      "ownership": "vault",
      "note": "REPORT-ONLY except the explicitly previewed, user-approved, add-only mcp-registration lifecycle transaction and the sole bridge-only legacy-qmd-reconciliation exception for an exact v1.20-compatible install, exact dormant qmd entry, absent qmd executable, and explicit removal approval"
    },
    {
      "id": "brain-obsidian",
      "path": ".obsidian",
      "kind": "dir",
      "ownership": "brain",
      "note": "shipped Obsidian defaults; a user's live workspace state is untracked"
    },
    {
      "id": "brain-dot-scripts",
      "path": ".scripts",
      "kind": "dir",
      "ownership": "brain"
    },
    {
      "id": "vault-inbox",
      "path": "00-Inbox",
      "kind": "dir",
      "ownership": "vault"
    },
    {
      "id": "seed-inbox-daily-plans-readme",
      "path": "00-Inbox/Daily_Plans/README.md",
      "kind": "file",
      "ownership": "seed"
    },
    {
      "id": "seed-inbox-ideas-readme",
      "path": "00-Inbox/Ideas/README.md",
      "kind": "file",
      "ownership": "seed"
    },
    {
      "id": "seed-inbox-meetings-readme",
      "path": "00-Inbox/Meetings/README.md",
      "kind": "file",
      "ownership": "seed"
    },
    {
      "id": "seed-inbox-readme",
      "path": "00-Inbox/README.md",
      "kind": "file",
      "ownership": "seed"
    },
    {
      "id": "vault-quarter-goals",
      "path": "01-Quarter_Goals",
      "kind": "dir",
      "ownership": "vault",
      "note": "capability-gated room (quarter_goals); absence is a valid state"
    },
    {
      "id": "seed-quarter-goals-file",
      "path": "01-Quarter_Goals/Quarter_Goals.md",
      "kind": "file",
      "ownership": "seed",
      "note": "capability-gated room (quarter_goals)"
    },
    {
      "id": "vault-week-priorities",
      "path": "02-Week_Priorities",
      "kind": "dir",
      "ownership": "vault"
    },
    {
      "id": "seed-week-priorities-file",
      "path": "02-Week_Priorities/Week_Priorities.md",
      "kind": "file",
      "ownership": "seed"
    },
    {
      "id": "vault-tasks",
      "path": "03-Tasks",
      "kind": "dir",
      "ownership": "vault"
    },
    {
      "id": "seed-tasks-file",
      "path": "03-Tasks/Tasks.md",
      "kind": "file",
      "ownership": "seed"
    },
    {
      "id": "vault-projects",
      "path": "04-Projects",
      "kind": "dir",
      "ownership": "vault"
    },
    {
      "id": "seed-projects-readme",
      "path": "04-Projects/README.md",
      "kind": "file",
      "ownership": "seed"
    },
    {
      "id": "vault-areas",
      "path": "05-Areas",
      "kind": "dir",
      "ownership": "vault",
      "note": "Career and Companies subtrees are capability-gated rooms; absence is a valid state"
    },
    {
      "id": "seed-career-evidence-readme",
      "path": "05-Areas/Career/Evidence/README.md",
      "kind": "file",
      "ownership": "seed",
      "note": "capability-gated room (career)"
    },
    {
      "id": "seed-companies-readme",
      "path": "05-Areas/Companies/README.md",
      "kind": "file",
      "ownership": "seed",
      "note": "capability-gated room (companies)"
    },
    {
      "id": "seed-people-external-readme",
      "path": "05-Areas/People/External/README.md",
      "kind": "file",
      "ownership": "seed"
    },
    {
      "id": "seed-people-internal-readme",
      "path": "05-Areas/People/Internal/README.md",
      "kind": "file",
      "ownership": "seed"
    },
    {
      "id": "seed-people-readme",
      "path": "05-Areas/People/README.md",
      "kind": "file",
      "ownership": "seed"
    },
    {
      "id": "seed-areas-readme",
      "path": "05-Areas/README.md",
      "kind": "file",
      "ownership": "seed"
    },
    {
      "id": "vault-resources",
      "path": "06-Resources",
      "kind": "dir",
      "ownership": "vault",
      "note": "fully user-owned per Vault_Contract \u00a710.1; the brain docs still shipped under 06-Resources/Dex_System carry their own brain rule until they relocate to docs/"
    },
    {
      "id": "brain-doc-background-processing",
      "path": "06-Resources/Dex_System/Background_Processing_Guide.md",
      "kind": "file",
      "ownership": "brain"
    },
    {
      "id": "brain-doc-calendar-setup",
      "path": "06-Resources/Dex_System/Calendar_Setup.md",
      "kind": "file",
      "ownership": "brain"
    },
    {
      "id": "brain-doc-jobs-to-be-done",
      "path": "06-Resources/Dex_System/Dex_Jobs_to_Be_Done.md",
      "kind": "file",
      "ownership": "brain"
    },
    {
      "id": "brain-doc-system-guide",
      "path": "06-Resources/Dex_System/Dex_System_Guide.md",
      "kind": "file",
      "ownership": "brain"
    },
    {
      "id": "brain-doc-technical-guide",
      "path": "06-Resources/Dex_System/Dex_Technical_Guide.md",
      "kind": "file",
      "ownership": "brain"
    },
    {
      "id": "brain-doc-distribution-checklist",
      "path": "06-Resources/Dex_System/Distribution_Checklist.md",
      "kind": "file",
      "ownership": "brain"
    },
    {
      "id": "brain-doc-distribution-strategy",
      "path": "06-Resources/Dex_System/Distribution_Strategy.md",
      "kind": "file",
      "ownership": "brain"
    },
    {
      "id": "brain-doc-folder-structure",
      "path": "06-Resources/Dex_System/Folder_Structure.md",
      "kind": "file",
      "ownership": "brain"
    },
    {
      "id": "brain-doc-memory-ownership",
      "path": "06-Resources/Dex_System/Memory_Ownership.md",
      "kind": "file",
      "ownership": "brain"
    },
    {
      "id": "brain-doc-named-sessions",
      "path": "06-Resources/Dex_System/Named_Sessions_Guide.md",
      "kind": "file",
      "ownership": "brain"
    },
    {
      "id": "brain-doc-obsidian-guide",
      "path": "06-Resources/Dex_System/Obsidian_Guide.md",
      "kind": "file",
      "ownership": "brain"
    },
    {
      "id": "brain-doc-dex-system-readme",
      "path": "06-Resources/Dex_System/README.md",
      "kind": "file",
      "ownership": "brain"
    },
    {
      "id": "brain-doc-updating-dex",
      "path": "06-Resources/Dex_System/Updating_Dex.md",
      "kind": "file",
      "ownership": "brain"
    },
    {
      "id": "seed-intel-gitkeep",
      "path": "06-Resources/Intel/.gitkeep",
      "kind": "file",
      "ownership": "seed"
    },
    {
      "id": "seed-meeting-intel-gitkeep",